url,reviewer,reviewer_avatar,datetime,rating,text,language,id,place_id
https://www.google.com/maps/reviews/data=!4m5!14m4!1m3!1m2!1s102661747201727499960!2s0x0:0xa1b937b5fe14fb16?hl=en-US,Carolina Franco,https://lh4.googleusercontent.com/-LYkM4Ap49nw/AAAAAAAAAAI/AAAAAAAAAAA/AMZuuckIUzifn4btLDNh4Na_EdRwUyHhKg/c0x00000000-cc-rp/photo.jpg,2020-08-29T06:13:00Z,5.0,"Experiencia impresionante.En serio, la mejor comida que he tenido en México.¡Simplemente asombroso!",es,11653406765589265174-1598670803.908,ChIJWZ2zdav40YURFvsU_rU3uaE
https://www.google.com/maps/reviews/data=!4m5!14m4!1m3!1m2!1s110685814705564199372!2s0x0:0xa1b937b5fe14fb16?hl=en-US,Rami Marquez,https://lh4.googleusercontent.com/-sFmIgw-zu5k/AAAAAAAAAAI/AAAAAAAAAAA/AMZuucls2tSaFJLe2zwjViJNYoO2MIFmCw/c0x00000000-cc-rp/photo.jpg,2020-08-29T01:10:00Z,5.0,¡La comida era increíble!Realmente disfruté la comida y el servicio.,es,11653406765589265174-1598652600.912,ChIJWZ2zdav40YURFvsU_rU3uaE
https://www.google.com/maps/reviews/data=!4m5!14m4!1m3!1m2!1s116311592627663765123!2s0x0:0xa1b937b5fe14fb16?hl=en-US,Jae Wook Jung,https://lh6.googleusercontent.com/-aLw3eg2Bdk4/AAAAAAAAAAI/AAAAAAAAAAA/AMZuucnI3F8Z_xwsFeqI7DRgtNT0pLAy3Q/c0x00000000-cc-rp/photo.jpg,2020-08-28T08:23:00Z,5.0,Realmente bueno,es,11653406765589265174-1598592188.447,ChIJWZ2zdav40YURFvsU_rU3uaE
https://www.google.com/maps/reviews/data=!4m5!14m4!1m3!1m2!1s106444996421433508595!2s0x0:0xa1b937b5fe14fb16?hl=en-US,Anastasiya Papusha,https://lh3.googleusercontent.com/a-/AOh14GiVaXdgeQ_YKoIEN13lRAPsqLNkv8w_ijhMcLvK-A=c0x00000000-cc-rp,2020-08-27T07:44:00Z,3.0,"El interior de este lugar es excepcional.El ambiente está absolutamente allí.Tuvimos uno de los mejores servidores de nuestra vida, Francisco.Su profesionalismo y actitud son absolutamente fantásticos.
Desafortunadamente, a pesar de la comida bellamente servida, el sabor era directamente mediocre.Lo mejor que probamos fue el aperitivo de maíz en el segundo curso, pero eso fue lo único bueno.No ofrecen maridaje de vinos, por lo que está atrapado tratando de elegir de más de 100 vinos para predecir qué funcionaría con su comida ... ¡No es su trabajo!

Y lo mejor para el final ... Encontré un cabello en mi tostada.Para compensarlo, simplemente se ofrecieron a repetir un curso.Estoy realmente decepcionado, el lugar no está a la altura de la exageración (y el precio que paga).",es,11653406765589265174-1598503484.381,ChIJWZ2zdav40YURFvsU_rU3uaE
https://www.google.com/maps/reviews/data=!4m5!14m4!1m3!1m2!1s114762255311182043402!2s0x0:0xa1b937b5fe14fb16?hl=en-US,Jim Martin,https://lh5.googleusercontent.com/-nrlcxzglLN0/AAAAAAAAAAI/AAAAAAAAAAA/AMZuuckbq9PbM0UtOoeK_eiubirDNIEYWg/c0x00000000-cc-rp/photo.jpg,2020-08-22T23:06:00Z,4.0,"Quería esperar 24 horas para pensar en esto antes de publicar.
No sé si llegué en un mal día, pero casi todos los platos que tenía en el menú de degustación estaba fuera de balance con sal o cítricos.La tostada con cangrejo estaba completamente dominada con ácido hasta el punto en que no podía probar nada más y el resto de los platos sabrosos estaban completamente abrumados por la sal.
El desierto era fabuloso.
Todavía le di cuatro estrellas porque el genio del menú es evidente, pero ese día la ejecución simplemente no estaba allí.
Es un espacio hermoso y el servicio era perfecto, al igual que la calidad de todos los ingredientes.",es,11653406765589265174-1598126782.008,ChIJWZ2zdav40YURFvsU_rU3uaE
https://www.google.com/maps/reviews/data=!4m5!14m4!1m3!1m2!1s110613634718119288680!2s0x0:0xa1b937b5fe14fb16?hl=en-US,Sergey Petrushkevich,https://lh3.googleusercontent.com/a-/AOh14GhxmP-KI8XglDGzmKcjQQpxkJQEKwaAh5EZPgdjqA=c0x00000000-cc-rp,2020-08-22T07:46:00Z,5.0,"¡El gerente, Eduardo, hizo que toda esta experiencia sea fantástica!Entré en el lugar, sin saber qué esperar, y mientras la comida empujó algunos de mis límites, me alejé muy feliz con la atención que me dieron.",es,11653406765589265174-1598071565.95,ChIJWZ2zdav40YURFvsU_rU3uaE
https://www.google.com/maps/reviews/data=!4m5!14m4!1m3!1m2!1s112995760995498953340!2s0x0:0xa1b937b5fe14fb16?hl=en-US,Diego Torres-Palma,https://lh6.googleusercontent.com/-ttuRA5RNX54/AAAAAAAAAAI/AAAAAAAAAAA/AMZuucl1mW8ZmziNcAAk23c7YCzsUTi6qA/c0x00000000-cc-rp/photo.jpg,2020-08-17T18:24:00Z,5.0,"¡Qué regalo culinario!Un nuevo menú (rehizo durante Covid) y es la esencia de los alimentos que se encuentra con el arte.Solo puedo describir esto como una cocina muy limpia y deliciosa.Si tuviera que elegir mi plato favorito, creo que el lunar fue el más memorable, ¡pero todos fueron absolutamente increíbles!",es,11653406765589265174-1597677857.649,ChIJWZ2zdav40YURFvsU_rU3uaE
https://www.google.com/maps/reviews/data=!4m5!14m4!1m3!1m2!1s102086683020804987620!2s0x0:0xa1b937b5fe14fb16?hl=en-US,Marcos Rosemberg,https://lh3.googleusercontent.com/a-/AOh14GhwylU9QuDNOCHlAWZPDKh_fZKI4PAfQpQLAewZE-0=c0x00000000-cc-rp,2020-08-15T04:55:00Z,5.0,Bien exquisito y espléndido sin duda lo mejor de México,es,11653406765589265174-1597456529.313,ChIJWZ2zdav40YURFvsU_rU3uaE
https://www.google.com/maps/reviews/data=!4m5!14m4!1m3!1m2!1s115106520232796363797!2s0x0:0xa1b937b5fe14fb16?hl=en-US,Andrea Carolina Suárez Bernal,https://lh3.googleusercontent.com/-P3fvF6tOikQ/AAAAAAAAAAI/AAAAAAAAAAA/AMZuucmF81T7vI0Yzg78bCeHUKlmPn3wAw/c0x00000000-cc-rp/photo.jpg,2020-08-14T06:17:00Z,5.0,Increíble,es,11653406765589265174-1597375053.061,ChIJWZ2zdav40YURFvsU_rU3uaE
https://www.google.com/maps/reviews/data=!4m5!14m4!1m3!1m2!1s117313513283669545104!2s0x0:0xa1b937b5fe14fb16?hl=en-US,Fallout Guy,https://lh6.googleusercontent.com/-Jtt74GAE1ek/AAAAAAAAAAI/AAAAAAAAAAA/AMZuucn7KZI8B-44Wiqdo_J5K3k69BYYQQ/c0x00000000-cc-rp/photo.jpg,2020-08-13T09:52:00Z,1.0,Meh,es,11653406765589265174-1597301565.2,ChIJWZ2zdav40YURFvsU_rU3uaE
https://www.google.com/maps/reviews/data=!4m5!14m4!1m3!1m2!1s106740803163376621900!2s0x0:0xa1b937b5fe14fb16?hl=en-US,Saul Paita,https://lh6.googleusercontent.com/-Tj2iYh0ZFmk/AAAAAAAAAAI/AAAAAAAAAC0/AMZuuclJ8LNYRLIkrRJsG0FHExtpHte-Tw/c0x00000000-cc-rp/photo.jpg,2020-08-12T21:48:00Z,2.0,"Terrible comida, sobrevalorada.Carece de profundidad y paleta de sabores.Lamentablemente, esta es una representación terrible de nuestros sabores latinos.Este chef parece estar en entrenamiento y tal vez algún día tendrá lo necesario para ofrecer comida de clase mundial, pero no hoy.",es,11653406765589265174-1597258080.489,ChIJWZ2zdav40YURFvsU_rU3uaE
https://www.google.com/maps/reviews/data=!4m5!14m4!1m3!1m2!1s101362894215205328271!2s0x0:0xa1b937b5fe14fb16?hl=en-US,Vega Pratt,https://lh3.googleusercontent.com/-_nlc5zIivGk/AAAAAAAAAAI/AAAAAAAAAAA/AMZuuckD2DcPP7lmTygshomNZz9gyd5IcA/c0x00000000-cc-rp/photo.jpg,2020-08-11T19:44:00Z,2.0,"La experiencia fue notable casi solo por lo decepcionante que fue.No soy de los que toman nota de cuán caras son las cosas o no porque eso es relativo en función del contexto (y también más bien Gauche), pero el menú de degustación vegetariana no era realmente una inversión digna de tiempo ni gastos.El enfoque principal de Pujol parece ser la pompa y la presentación, lo cual es inherentemente bien.Solo desearía que la comida proporcionada estuviera en línea con la exageración que rodea el restaurante en sí.Estaba esperando toda la noche para que me sorprendiera un curso destacado, pero el momento nunca sucedió.Realmente es solo comida callejera mexicana para Gringos (que soy, es cierto).Definitivamente volvería, pero solo para los cócteles y la selección de vinos.Solo come un pastor de Al antes de que vengas.Seguirá siendo una buena experiencia.",es,11653406765589265174-1597164256.284,ChIJWZ2zdav40YURFvsU_rU3uaE
https://www.google.com/maps/reviews/data=!4m5!14m4!1m3!1m2!1s100555299536138653166!2s0x0:0xa1b937b5fe14fb16?hl=en-US,Miriam Mejia,https://lh3.googleusercontent.com/a-/AOh14GgUeWGBKHAocoEW47Wlk-T0k-Nvz7XpAbyHUpvO=c0x00000000-cc-rp,2020-08-08T22:34:00Z,5.0,¡Excelente y suficiente comida!,es,11653406765589265174-1596915255.417,ChIJWZ2zdav40YURFvsU_rU3uaE
https://www.google.com/maps/reviews/data=!4m5!14m4!1m3!1m2!1s117042278154042712420!2s0x0:0xa1b937b5fe14fb16?hl=en-US,Jess O,https://lh5.googleusercontent.com/-px99nnBIEao/AAAAAAAAAAI/AAAAAAAAAAA/AMZuuckQjRr1oKuS6tu_uvkWKLjkPXxWQA/c0x00000000-cc-rp/photo.jpg,2020-08-06T22:28:00Z,5.0,Amazing.,es,11653406765589265174-1596742092.483,ChIJWZ2zdav40YURFvsU_rU3uaE
https://www.google.com/maps/reviews/data=!4m5!14m4!1m3!1m2!1s103041223949651206460!2s0x0:0xa1b937b5fe14fb16?hl=en-US,Jielin,https://lh3.googleusercontent.com/a-/AOh14Gj163BVCG1U6Hh3gmNdkXUKWHbv1zRAvdARxlPbgw=c0x00000000-cc-rp,2020-07-27T05:50:00Z,5.0,Increíble cena y experiencia.,es,11653406765589265174-1595818233.877,ChIJWZ2zdav40YURFvsU_rU3uaE
https://www.google.com/maps/reviews/data=!4m5!14m4!1m3!1m2!1s114304747420432272108!2s0x0:0xa1b937b5fe14fb16?hl=en-US,Nitin Malla,https://lh3.googleusercontent.com/-HArNSGT8jkk/AAAAAAAAAAI/AAAAAAAAAAA/AMZuucmeR1P2Kfsp6ZjUSDgqwLFybx_BzQ/c0x00000000-cc-rp/photo.jpg,2020-07-21T07:58:00Z,5.0,Una de la mejor experiencia gastronómica que he tenido.,es,11653406765589265174-1595307524.462,ChIJWZ2zdav40YURFvsU_rU3uaE
https://www.google.com/maps/reviews/data=!4m5!14m4!1m3!1m2!1s110146455446304223683!2s0x0:0xa1b937b5fe14fb16?hl=en-US,bruno zesati,https://lh3.googleusercontent.com/-6uKlS73zZdU/AAAAAAAAAAI/AAAAAAAAAAA/AMZuuclnQ458fXbHVj5bg9NUFZ42aA3i_g/c0x00000000-cc-rp/photo.jpg,2020-07-17T05:29:00Z,5.0,El mejor lugar de México por mucha experiencia maravillosa,es,11653406765589265174-1594952941.463,ChIJWZ2zdav40YURFvsU_rU3uaE
https://www.google.com/maps/reviews/data=!4m5!14m4!1m3!1m2!1s101018227990880133818!2s0x0:0xa1b937b5fe14fb16?hl=en-US,Jeannie Frantz,https://lh3.googleusercontent.com/a-/AOh14GivZWD9skLs6aXxsJqceQWDXkAJ-s-B6OPqTs_dEg=c0x00000000-cc-rp,2020-07-14T07:14:00Z,5.0,"Fuimos a la Ciudad de México específicamente para este restaurante.Además del hecho de que la Ciudad de México es la ciudad más bella e interesante del mundo, Pujol estuvo a la altura de todas las expectativas.Los lugareños nos burlaron de lo emocionados que estábamos de pagar un montón de dinero por los tacos (porque el juego de los tacos callejeros de la Ciudad de México es una locura), pero cuando fuimos ... Lordy.Lloré.Cada curso, cada bocado, fue el mejor bocado que he tenido en mi vida.Estos tipos lo están aplastando.Gracias por los recuerdos de toda la vida.",es,11653406765589265174-1594700071.008,ChIJWZ2zdav40YURFvsU_rU3uaE
https://www.google.com/maps/reviews/data=!4m5!14m4!1m3!1m2!1s116029741988503232377!2s0x0:0xa1b937b5fe14fb16?hl=en-US,Joshua Barsch,https://lh3.googleusercontent.com/a-/AOh14Gjj91yDYMmVp6_HQWCzcPoisECwxOJdP4RxVm_r2w=c0x00000000-cc-rp,2020-07-12T21:52:00Z,5.0,"Algunos críticos de comida consideran que este es el mejor restaurante de América del Norte.El menú de degustación fue increíble, 2 horas y 9 cursos, además de un churro adicional al final.Una experiencia increíble.",es,11653406765589265174-1594579924.5,ChIJWZ2zdav40YURFvsU_rU3uaE
https://www.google.com/maps/reviews/data=!4m5!14m4!1m3!1m2!1s115115026243856305071!2s0x0:0x3ff9dcc831aaa866?hl=en-US,Arturo Diaz,https://lh6.googleusercontent.com/-xENOxUBxw4I/AAAAAAAAAAI/AAAAAAAAAAA/AMZuuckAU1y7mdHgmKWftWAf2oqt5UVrHA/c0x00000000-cc-rp/photo.jpg,2020-09-11T04:23:00Z,5.0,Gran filetes de corte de Sonora,es,4609958445975251046-1599787422.389,ChIJwZyJ2nP_0YURZqiqMcjc-T8
https://www.google.com/maps/reviews/data=!4m5!14m4!1m3!1m2!1s101539077073892714490!2s0x0:0x3ff9dcc831aaa866?hl=en-US,ricardo cortina,https://lh3.googleusercontent.com/a-/AOh14Gjt9FWmrvqtg8JfKKmzEtPSs8KIbvZVrjIBatjc=c0x00000000-cc-rp,2020-03-16T04:51:00Z,5.0,Como Sonora Meat Rancho 17 .. ¡Buenas recetas!,es,4609958445975251046-1584323473.273,ChIJwZyJ2nP_0YURZqiqMcjc-T8
https://www.google.com/maps/reviews/data=!4m5!14m4!1m3!1m2!1s100472450823019728731!2s0x0:0xc9791b4f5f9ad07e?hl=en-US,Flakis Fresky,https://lh3.googleusercontent.com/a-/AOh14GhtDIA6nDqRbWRKNtY257A7h7FeodABdjVGJfgWCGk=c0x00000000-cc-rp,2020-02-26T08:14:00Z,5.0,Fiambres,es,14517664901525852286-1582694040.432,ChIJx_X5T2wC0oURftCaX08beck
https://www.google.com/maps/reviews/data=!4m5!14m4!1m3!1m2!1s113305038376534868979!2s0x0:0xc9791b4f5f9ad07e?hl=en-US,David Plaza,https://lh6.googleusercontent.com/-Caj2RcGV0JE/AAAAAAAAAAI/AAAAAAAAAAA/AMZuuclLv970Lpe__fDG18LxmW5Vz6zTiw/c0x00000000-cc-rp/photo.jpg,2020-02-04T02:47:00Z,4.0,De acuerdo,es,14517664901525852286-1580773677.371,ChIJx_X5T2wC0oURftCaX08beck
https://www.google.com/maps/reviews/data=!4m5!14m4!1m3!1m2!1s106924345066273523563!2s0x0:0xc9791b4f5f9ad07e?hl=en-US,Jey Ruiz,https://lh3.googleusercontent.com/-x6lXF9dLeuQ/AAAAAAAAAAI/AAAAAAAAAAA/AMZuuckbOMqs5TiSe39SQIIjp5dN18RIfg/c0x00000000-cc-rp/photo.jpg,2019-11-15T03:58:00Z,5.0,Todo lo que pruebes es delicioso,es,14517664901525852286-1573779535.353,ChIJx_X5T2wC0oURftCaX08beck
https://www.google.com/maps/reviews/data=!4m5!14m4!1m3!1m2!1s113485702475445034498!2s0x0:0xc9791b4f5f9ad07e?hl=en-US,José Luis Sánchez,https://lh5.googleusercontent.com/-Ne8LZN25v1E/AAAAAAAAAAI/AAAAAAAAAAA/AMZuuckvTefQg9vdQrYiUnkrkwnkyYB6Pw/c0x00000000-cc-rp/photo.jpg,2019-10-03T05:04:00Z,5.0,De acuerdo,es,14517664901525852286-1570068260.997,ChIJx_X5T2wC0oURftCaX08beck
https://www.google.com/maps/reviews/data=!4m5!14m4!1m3!1m2!1s117017292373562387414!2s0x0:0x530dc85774a6def9?hl=en-US,Chauvigny Palmira,https://lh3.googleusercontent.com/a-/AOh14GjsXCMxN1rok8BMpC72OBkDXcKiDclB_4hZNek8=c0x00000000-cc-rp,2019-10-25T02:41:00Z,5.0,El verdadero sabor de Oaxaca,es,5984659757790060281-1571960475.118,ChIJXa73W8r40YUR-d6mdFfIDVM
https://www.google.com/maps/reviews/data=!4m5!14m4!1m3!1m2!1s107243914182900304382!2s0x0:0x530dc85774a6def9?hl=en-US,Jose Nogueron,https://lh5.googleusercontent.com/-pKYcDB1zIW0/AAAAAAAAAAI/AAAAAAAAAAA/AMZuucm_2o1LNi28RGTWYcWK4od2GWwQpA/c0x00000000-cc-rp/photo.jpg,2019-04-26T15:32:00Z,2.0,Nariz,es,5984659757790060281-1556281959.185,ChIJXa73W8r40YUR-d6mdFfIDVM
https://www.google.com/maps/reviews/data=!4m5!14m4!1m3!1m2!1s110031824226270752928!2s0x0:0x7ffdc55d24154ce6?hl=en-US,Tae E. Kim,https://lh3.googleusercontent.com/a-/AOh14GhENxzDRVVRd81fZvG2btYwt_ArfmRgNTMd-DmGPSI=c0x00000000-cc-rp,2020-08-10T07:30:00Z,5.0,"Excelente selección de comida y vino, servicio fantástico y una experiencia distinta de CDMX para los visitantes.",es,9222744615752649958-1597033806.107,ChIJxaXnZgIC0oUR5kwVJF3F_X8
https://www.google.com/maps/reviews/data=!4m5!14m4!1m3!1m2!1s113458124621196445763!2s0x0:0x7ffdc55d24154ce6?hl=en-US,Amanda Crook,https://lh6.googleusercontent.com/-B3sIf1OBFn8/AAAAAAAAAAI/AAAAAAAAAAA/AMZuuckJLnqPradw1Gvsv0guAbWvSA1LKg/c0x00000000-cc-rp/photo.jpg,2020-03-22T02:24:00Z,5.0,"Uno de los mejores, si no la mejor comida que tuvimos en la Ciudad de México.El lugar en sí es muy hermoso y la comida por igual.Cada plato era como comer una obra de arte que diseñó y creó cuidadosamente.¡La comida y las bebidas eran deliciosas!El servicio fue excelente.Vinimos para mi cumpleaños y nos dieron moet y algo de pastel y helado.El restaurante está ubicado en una parte muy segura y acomodada de la ciudad.¡Definitivamente volveremos en nuestro próximo viaje!",es,9222744615752649958-1584833070.624,ChIJxaXnZgIC0oUR5kwVJF3F_X8
https://www.google.com/maps/reviews/data=!4m5!14m4!1m3!1m2!1s108698644748203195710!2s0x0:0x7ffdc55d24154ce6?hl=en-US,Hernan O,https://lh3.googleusercontent.com/a-/AOh14GjMY2o3X_d046PR_PlsVNqjaNX0YmoxtWBMUY6KHQ=c0x00000000-cc-rp,2020-02-25T06:12:00Z,4.0,"No importa lo que comas, lo que definitivamente te gustará, solo pide el flan como postre.No te equivocarás.De nada.",es,9222744615752649958-1582600363.504,ChIJxaXnZgIC0oUR5kwVJF3F_X8
https://www.google.com/maps/reviews/data=!4m5!14m4!1m3!1m2!1s116578504618817290080!2s0x0:0x7ffdc55d24154ce6?hl=en-US,Todd Hata,https://lh3.googleusercontent.com/a-/AOh14GgGNT-EIMeG9_QUmpV4m7NWDOPj2hmhoK475IS2yQ=c0x00000000-cc-rp,2020-02-10T04:07:00Z,5.0,"¡Este es mi restaurante favorito en México!Comeré aquí una o dos veces cada vez que visite la Ciudad de México.Esta vez, nuestro grupo ordenó un montón de aperitivos, algunas ensaladas, y estaban demasiado llenos para los platos principales.Así que terminamos ordenando algunos postres para terminar esta increíble comida.Dulce Patria nunca deja de impresionarme con sus platos creativos y deliciosos.",es,9222744615752649958-1581296837.107,ChIJxaXnZgIC0oUR5kwVJF3F_X8
https://www.google.com/maps/reviews/data=!4m5!14m4!1m3!1m2!1s106935649680243509783!2s0x0:0x7ffdc55d24154ce6?hl=en-US,Curt Craig,https://lh3.googleusercontent.com/a-/AOh14GhYwqTxn3FCNQrKFB1pgNOMQEf7bOlvOboWN5H9=c0x00000000-cc-rp,2020-02-09T02:50:00Z,4.0,"Este lugar era genial, ¡y las bebidas eran fantásticas!",es,9222744615752649958-1581205822.698,ChIJxaXnZgIC0oUR5kwVJF3F_X8
https://www.google.com/maps/reviews/data=!4m5!14m4!1m3!1m2!1s115499520644055554604!2s0x0:0x7ffdc55d24154ce6?hl=en-US,John Starkweather,https://lh3.googleusercontent.com/a-/AOh14Gir1ehW3UGpk5dGobChjqdqiu2VLxhfgxQMXoJt9g=c0x00000000-cc-rp,2020-02-02T19:59:00Z,5.0,Sabores y ambiente asombrosos.¡Altamente recomendado!,es,9222744615752649958-1580662743.963,ChIJxaXnZgIC0oUR5kwVJF3F_X8
https://www.google.com/maps/reviews/data=!4m5!14m4!1m3!1m2!1s103393454877034258894!2s0x0:0x7ffdc55d24154ce6?hl=en-US,Jose Carlos Alarcon Lopez,https://lh3.googleusercontent.com/a-/AOh14Gg9ybyEA5HH9WgxcIkWZcrRNswjG4_hXoCXp5e5=c0x00000000-cc-rp,2020-01-27T21:21:00Z,4.0,"Socialité spot muy elegante para una cita para impresionar, sabroso buen servicio, excelente ubicación.
Todo es bueno y caro.Un lugar bien merecido en la lista amplia ""120"" del país de México.
La reserva es casi imprescindible.",es,9222744615752649958-1580149273.309,ChIJxaXnZgIC0oUR5kwVJF3F_X8
https://www.google.com/maps/reviews/data=!4m5!14m4!1m3!1m2!1s113157226809445428178!2s0x0:0x7ffdc55d24154ce6?hl=en-US,Xavier Boyaval,https://lh4.googleusercontent.com/-7QmAeu0uYzw/AAAAAAAAAAI/AAAAAAAAAAA/AMZuucmAKGW4f-g6DlXv8I82LhlLTRqUdg/c0x00000000-cc-rp/photo.jpg,2020-01-26T07:07:00Z,1.0,"Gran decepción.La comida era decente, pero no coincidía con las expectativas después de todo el zumbido que rodeaba ese restaurante.El servicio fue terrible.Nuestro camarero incluso no estaba entrenado o tenía un mal día.Cuando hicimos preguntas, se escapó e ignoró nuestra mesa.¡En este punto decidimos omitir el postre!
Nuestra experiencia alimentaria en la Ciudad de México fue increíble y descubrimos algunos deliciosos restaurantes.Lamentablemente, Dulce Patria no hizo el corte.",es,9222744615752649958-1580011625.248,ChIJxaXnZgIC0oUR5kwVJF3F_X8
https://www.google.com/maps/reviews/data=!4m5!14m4!1m3!1m2!1s111878435005590501708!2s0x0:0x7ffdc55d24154ce6?hl=en-US,Alice Lobos,https://lh3.googleusercontent.com/a-/AOh14GjPQRZTp9RNUvd5BQ8Dm7b2CdsqEEjphg5wa22lSA=c0x00000000-cc-rp,2020-01-21T07:02:00Z,2.0,"Restaurante muy caro y extremadamente refinado.Tomó unos 20 minutos entregar el menú de alimentos, ofrecer mil bebidas y envolvernos",es,9222744615752649958-1579579345.758,ChIJxaXnZgIC0oUR5kwVJF3F_X8
https://www.google.com/maps/reviews/data=!4m5!14m4!1m3!1m2!1s110837958836959319696!2s0x0:0x7ffdc55d24154ce6?hl=en-US,Richard Ago,https://lh3.googleusercontent.com/a-/AOh14GiuGrtvphOhqGaK0mGgt-EeyPjX9GYFKxaOFTnfVg=c0x00000000-cc-rp,2019-12-10T05:03:00Z,5.0,"Experiencia asombrosa.Si eres un hablante de inglés, no tendrás dificultades aquí.Altamente recomendado.",es,9222744615752649958-1575943388.769,ChIJxaXnZgIC0oUR5kwVJF3F_X8
https://www.google.com/maps/reviews/data=!4m5!14m4!1m3!1m2!1s118377528698241914015!2s0x0:0x7ffdc55d24154ce6?hl=en-US,Fernando Macedo,https://lh3.googleusercontent.com/a-/AOh14Gj0lFEMqUSewCY0iL86_09Nz_qjjIOSL-rt4aZe=c0x00000000-cc-rp,2019-12-08T17:44:00Z,2.0,"El restaurante está sobrevalorado
La calidad de la comida es excelente y el servicio fue realmente pobre
El vino que solicité no estaba disponible
Esperamos más de 40 minutos antes de obtener pan o aperitivos.
El camarero estaba tratando de ofrecer siempre los platos más caros.
El precio del vino era tres veces más caro que el precio de la calle, cuando generalmente obtengo dos veces el costo en el restaurante.
Obtuvimos nuestros platos después de preguntar tres veces por hora después y el lugar no estaba lleno",es,9222744615752649958-1575816246.666,ChIJxaXnZgIC0oUR5kwVJF3F_X8
https://www.google.com/maps/reviews/data=!4m5!14m4!1m3!1m2!1s117282285886655559025!2s0x0:0x7ffdc55d24154ce6?hl=en-US,Marie Lefebvre,https://lh3.googleusercontent.com/a-/AOh14GiHl4WprBuFRKbz4HDMC0zulxnbt0ccLOvpPdNGuw=c0x00000000-cc-rp,2019-12-04T01:20:00Z,4.0,"La comida y la presentación donde es superior al promedio y a mí nos encantó lo justos que eran los precios de la calidad y la ubicación en uno de los vecindarios más caros de México.Quité una estrella porque sentía que los servidores constantemente trataban de ventaste.Cuando llegue, preguntan si desea una Agua Fresca de inmediato y hace que parezca una cortesía, pero en realidad hay un costo.Nunca sé con este tipo de calibre de restaurantes lo que realmente tiene un costo o lo que es parte del servicio/ An Amuse Bouche.Te dan porciones gratuitas (pequeñas) de dulces mexicanos tradicionales al final con el cheque, que es un buen toque.",es,9222744615752649958-1575411612.458,ChIJxaXnZgIC0oUR5kwVJF3F_X8
https://www.google.com/maps/reviews/data=!4m5!14m4!1m3!1m2!1s104562631122714971182!2s0x0:0x7ffdc55d24154ce6?hl=en-US,David Ayala-Alfonso,https://lh3.googleusercontent.com/a-/AOh14GgIprcFRfVPbZE9DuhJtZiF_O7x4WClCwGGueR2ncQ=c0x00000000-cc-rp,2019-11-29T02:56:00Z,4.0,"A pesar de que el aspecto del restaurante es extraño, la comida es realmente excelente.Prepárese para no tener una gran fiesta, sino para disfrutar de pequeñas muestras de sabores tradicionales elevados bastante bien por este elemento básico de la Ciudad de México.",es,9222744615752649958-1574985401.484,ChIJxaXnZgIC0oUR5kwVJF3F_X8
https://www.google.com/maps/reviews/data=!4m5!14m4!1m3!1m2!1s106926879816079982042!2s0x0:0x7ffdc55d24154ce6?hl=en-US,アジア敏,https://lh3.googleusercontent.com/a-/AOh14GhxqE6xKkydDuhZoOTL_1RD9_MElYJqZDMYriEe3A=c0x00000000-cc-rp,2019-11-28T11:24:00Z,3.0,neutral,es,9222744615752649958-1574929469.738,ChIJxaXnZgIC0oUR5kwVJF3F_X8
https://www.google.com/maps/reviews/data=!4m5!14m4!1m3!1m2!1s105418634731243154043!2s0x0:0x7ffdc55d24154ce6?hl=en-US,Emmanuel Manrique,https://lh3.googleusercontent.com/a-/AOh14GgfXdoOUDayss8Vpra0vg9Hn_RKypDb5Dk18WpCkIU=c0x00000000-cc-rp,2019-11-04T06:42:00Z,3.0,"Entre el precio y la calidad más la cantidad, los platos son demasiado caros.Creo que las habilidades del chef Martha no están en duda, sino la relación costo-beneficio.",es,9222744615752649958-1572838941.005,ChIJxaXnZgIC0oUR5kwVJF3F_X8
https://www.google.com/maps/reviews/data=!4m5!14m4!1m3!1m2!1s116234507640906992056!2s0x0:0x7ffdc55d24154ce6?hl=en-US,Kevin H. Nguyen,https://lh4.googleusercontent.com/-Ao5-SU4Kt70/AAAAAAAAAAI/AAAAAAAAAAA/AMZuucnnZoyOQPz44jt62UB-pzoNqNti6A/c0x00000000-cc-rp/photo.jpg,2019-11-02T17:40:00Z,5.0,"Este es un gran restaurante.Excelentes comidas, postres y servicios.Los camareros y los chefs se toman su tiempo para presentar los alimentos y postres en consecuencia a las tradiciones de México.Además, excelente selección de vinos y debe probar la bebida de la bandera.El amor está aquí y muy recomendable.",es,9222744615752649958-1572705644.955,ChIJxaXnZgIC0oUR5kwVJF3F_X8
https://www.google.com/maps/reviews/data=!4m5!14m4!1m3!1m2!1s106927032453945744122!2s0x0:0xa20f8063034c8134?hl=en-US,Alfredo Jimenez Guzman,https://lh3.googleusercontent.com/a-/AOh14Gh9_70A2F33ImPcW4MWVlSghOICQRgYTW2biqlBoR0=c0x00000000-cc-rp,2020-10-06T20:12:00Z,5.0,Guau,es,11677693521540448564-1602004337.797,ChIJxSUeddX-0YURNIFMA2OAD6I
https://www.google.com/maps/reviews/data=!4m5!14m4!1m3!1m2!1s118173165576918303545!2s0x0:0xa20f8063034c8134?hl=en-US,Samuel Rodríguez,https://lh3.googleusercontent.com/-7nE1IaDixv8/AAAAAAAAAAI/AAAAAAAAAAA/AMZuucne4wYevXHMNod2fdCvLrvCdu-2xA/c0x00000000-cc-rp/photo.jpg,2020-10-05T02:10:00Z,5.0,Excelente lugar para comer gourmet.,es,11677693521540448564-1601853050.018,ChIJxSUeddX-0YURNIFMA2OAD6I
https://www.google.com/maps/reviews/data=!4m5!14m4!1m3!1m2!1s111059323161890217045!2s0x0:0x5e1e17a92c33ed39?hl=en-US,Carlos Gómez Haslam,https://lh3.googleusercontent.com/a-/AOh14GgGbumqwTThVpADwFK8qyJOcRMvJN8RxX6P3VD6=c0x00000000-cc-rp,2020-04-16T07:03:00Z,5.0,El vientre de Rich Anita,es,6781884104225058105-1587009787.288,ChIJXxwZxdX-0YUROe0zLKkXHl4
https://www.google.com/maps/reviews/data=!4m5!14m4!1m3!1m2!1s104132503196874145246!2s0x0:0x5e1e17a92c33ed39?hl=en-US,Steven Anderson,https://lh3.googleusercontent.com/-XoBIl3Qofjs/AAAAAAAAAAI/AAAAAAAAAAA/AMZuuclDyWsF-fiHdWV3Hx6nBBMXHeHGzA/c0x00000000-cc-rp/photo.jpg,2020-03-17T17:55:00Z,5.0,"Si te gusta Menudo, este es el lugar para ir.Impresionante por todas partes.El tazón pequeño es del tamaño correcto y el café es excelente.Bien vale la pena venir aquí.",es,6781884104225058105-1584456910.09,ChIJXxwZxdX-0YUROe0zLKkXHl4
https://www.google.com/maps/reviews/data=!4m5!14m4!1m3!1m2!1s115349063437240503381!2s0x0:0x5e1e17a92c33ed39?hl=en-US,Guido Sartor,https://lh3.googleusercontent.com/-Z-yHnxUov5w/AAAAAAAAAAI/AAAAAAAAAAA/AMZuucmuO2wz4EFMKwqWFpaJ-eXTumXvIw/c0x00000000-cc-rp/photo.jpg,2019-11-27T05:34:00Z,5.0,"Lugar muy simple pero sorprendente.
Puede pedir pancita (tripas en caldo) en un tazón mediano o grande.Hacen solo una cosa, pero lo hacen espectacularmente bien.
Y por el aspecto parece un lugar con gran tradición y éxito.",es,6781884104225058105-1574822063.852,ChIJXxwZxdX-0YUROe0zLKkXHl4
