url,reviewer,reviewer_avatar,datetime,rating,text,language,id,place_id
https://www.google.com/maps/reviews/data=!4m5!14m4!1m3!1m2!1s100640400400760848981!2s0x0:0x51f5f793f0588b49?hl=en-US,Jordi Gonzalez,https://lh3.googleusercontent.com/a-/AOh14GhXEXnmnzfYpIH4pTUQyixfJGc2i9oRaW3IeghRrg=c0x00000000-cc-rp,2020-09-11T18:27:00Z,5.0,Muy buen restaurante en Polanco.Alimentos de alta calidad con un excelente servicio.,es,5905898701130861385-1599838042.098,ChIJPVNOCAAC0oURSYtY8JP39VE
https://www.google.com/maps/reviews/data=!4m5!14m4!1m3!1m2!1s100894306658286579675!2s0x0:0x51f5f793f0588b49?hl=en-US,Rubén Mejía,https://lh3.googleusercontent.com/a-/AOh14Gh2ZWBpfT3Of_bfl_cERgnD3mwF1iSIXOXH_IX5vA=c0x00000000-cc-rp,2020-09-02T01:42:00Z,5.0,Bonito lugar y sabrosa comida mexicana,es,5905898701130861385-1599000154.219,ChIJPVNOCAAC0oURSYtY8JP39VE
https://www.google.com/maps/reviews/data=!4m5!14m4!1m3!1m2!1s104410331234892773777!2s0x0:0x51f5f793f0588b49?hl=en-US,Robert Gtz,https://lh3.googleusercontent.com/a-/AOh14GhUQASpbXSQ6re4MTITMkfxw9MWgaqSHyFJy3VZ6Q=c0x00000000-cc-rp,2020-08-29T08:07:00Z,5.0,"Maravilloso restaurante para una experiencia verdaderamente agradable.Su declaración de misión es recrear sus comidas y entretenimiento más tradicionales.¡Los cócteles están hechos a mano y de alta calidad, incluida deliciosa comida y desiertos!Por último, el servicio fue excelente por todos los miembros del personal.Este es un restaurante de visita obligada para obtener comida de alta calidad con inspiración tradicional.",es,5905898701130861385-1598677652.184,ChIJPVNOCAAC0oURSYtY8JP39VE
https://www.google.com/maps/reviews/data=!4m5!14m4!1m3!1m2!1s117508846768259076331!2s0x0:0x51f5f793f0588b49?hl=en-US,arturo loyo,https://lh3.googleusercontent.com/a-/AOh14GirOwtRRMUjIMqdIQCIlmXDZwgKUV1RDYQnofdF=c0x00000000-cc-rp,2020-08-15T00:53:00Z,5.0,"Excelente lugar para cenar excelente ambiente, excelente comida, bistec y guarniciones, el postre tenía sabores realmente agradables.",es,5905898701130861385-1597442036.521,ChIJPVNOCAAC0oURSYtY8JP39VE
https://www.google.com/maps/reviews/data=!4m5!14m4!1m3!1m2!1s115822613241880227810!2s0x0:0x51f5f793f0588b49?hl=en-US,Elijah Riojas,https://lh3.googleusercontent.com/a-/AOh14GjuPuSqlbBir49pRy5Nf65QsfJc1YiY1Xa68hiZ=c0x00000000-cc-rp,2020-08-04T00:25:00Z,5.0,"Este lugar fue increíble.El personal del bar, el camarero y la anfitriona fueron muy agradables.La presentación de alimentos/bebidas fue más allá de mis expectativas.",es,5905898701130861385-1596489909.477,ChIJPVNOCAAC0oURSYtY8JP39VE
https://www.google.com/maps/reviews/data=!4m5!14m4!1m3!1m2!1s103185227233940305962!2s0x0:0x51f5f793f0588b49?hl=en-US,Neha Mac,https://lh4.googleusercontent.com/-yjqc4F5mK2Q/AAAAAAAAAAI/AAAAAAAAAAA/AMZuuclGUD61wKfcER1jFDCdbkLKr_OKVA/c0x00000000-cc-rp/photo.jpg,2020-03-09T22:32:00Z,5.0,Buena comida y ambiente realmente divertido.Seguro que volveré la próxima vez que esté en la ciudad.,es,5905898701130861385-1583782360.899,ChIJPVNOCAAC0oURSYtY8JP39VE
https://www.google.com/maps/reviews/data=!4m5!14m4!1m3!1m2!1s100485336214015492163!2s0x0:0x7e7ecbd58b7d7d2e?hl=en-US,Enrique Lemus,https://lh3.googleusercontent.com/a-/AOh14GhcNp9qE76VSvDO8DK8c6Uymm3idl71QMOaILx_iQ=c0x00000000-cc-rp,2019-03-05T20:42:00Z,5.0,¡Buena comida!¡Dirigido por un verdadero chef!Buen ambiente estudiantil.,es,9114946813873192238-1551807720.658,ChIJPZR8esX_0YURLn19i9XLfn4
https://www.google.com/maps/reviews/data=!4m5!14m4!1m3!1m2!1s114931717185250634758!2s0x0:0xfea3db2a133813dc?hl=en-US,José Manuel Ruiz Ramírez,https://lh3.googleusercontent.com/a-/AOh14Gg-NKQ2aSJoMmSrsfuuWBS2tg4QHwQjU5xV6hmhSXo=c0x00000000-cc-rp,2020-10-03T20:49:00Z,5.0,Es muy agradable venir el espacio y pasar un buen día y tarde con buena comida.El personal es realmente agradable y el menú tiene muy buenas opciones sabrosas.,es,18348750280595084252-1601747379.315,ChIJQ7PTnCQB0oUR3BM4Eyrbo_4
https://www.google.com/maps/reviews/data=!4m5!14m4!1m3!1m2!1s109137784183617453236!2s0x0:0xfea3db2a133813dc?hl=en-US,BD Murphy,https://lh3.googleusercontent.com/a-/AOh14GjQmwK30RUaLmjI2ig3u6_F2dVtLLHjWLhj1EWg0Q=c0x00000000-cc-rp,2020-07-24T04:13:00Z,5.0,Recomendado por un chef (NICO) después de una gira de comida para caminar.Debe comer lugar si visita CDMX.,es,18348750280595084252-1595553232.849,ChIJQ7PTnCQB0oUR3BM4Eyrbo_4
https://www.google.com/maps/reviews/data=!4m5!14m4!1m3!1m2!1s114274311091641519412!2s0x0:0xfea3db2a133813dc?hl=en-US,Tiana Cornelius,https://lh3.googleusercontent.com/a-/AOh14Ggw8A6jVZQOxiVVq7XZrEYTPuxAFiruSvZwJx2KwQ=c0x00000000-cc-rp,2020-03-14T23:35:00Z,5.0,"¡Mi nuevo restaurante mexicano favorito en la ciudad!La comida era deliciosa e inspirada.El servicio fue competente y amigable.El dueño estaba sentado en una mesa junto a nosotros y se presentó.Me encanta este lugar, lo recomiendo!",es,18348750280595084252-1584218105.486,ChIJQ7PTnCQB0oUR3BM4Eyrbo_4
https://www.google.com/maps/reviews/data=!4m5!14m4!1m3!1m2!1s110885037824742146620!2s0x0:0xfea3db2a133813dc?hl=en-US,Martin Navarro,https://lh3.googleusercontent.com/a-/AOh14GhSBlxQcphUz_uvXzTqX_Wdagc-qhZx5080JY3b=c0x00000000-cc-rp,2020-02-22T07:27:00Z,4.0,Cozy..,es,18348750280595084252-1582345674.26,ChIJQ7PTnCQB0oUR3BM4Eyrbo_4
https://www.google.com/maps/reviews/data=!4m5!14m4!1m3!1m2!1s103317521668653072657!2s0x0:0xfea3db2a133813dc?hl=en-US,Alper Ozdemir,https://lh3.googleusercontent.com/a-/AOh14Gi3FFweo2JRjwHzFFj_Prer0atVN0v6pxGoxDn8vA=c0x00000000-cc-rp,2020-02-16T21:49:00Z,3.0,"Entró con grandes esperanzas decepcionadas.La comida no estaba equilibrada, si el cangrejo azul fuera sobre ácido, la panceta de cerdo era demasiado grasosa y no se cocinaba lo suficiente ya que la carne no estaba húmeda.Hay la oportunidad de mejorar, volveremos a visitar en el futuro.",es,18348750280595084252-1581878958.391,ChIJQ7PTnCQB0oUR3BM4Eyrbo_4
https://www.google.com/maps/reviews/data=!4m5!14m4!1m3!1m2!1s108913420757893498659!2s0x0:0xfea3db2a133813dc?hl=en-US,Christian Mathews-Gagne,https://lh3.googleusercontent.com/a-/AOh14GgS_jHMNoJ5iCXQISqZ9eLeSewJ32LkhKkdxU51lA=c0x00000000-cc-rp,2020-02-16T02:40:00Z,3.0,"Ingredientes de alta calidad ejecutados bien en su mayor parte.Nuestro pulpo estaba demasiado cocido y el servicio era muy pobre, pero consideraría visitar nuevamente.Buen valor por el precio.",es,18348750280595084252-1581810057.154,ChIJQ7PTnCQB0oUR3BM4Eyrbo_4
https://www.google.com/maps/reviews/data=!4m5!14m4!1m3!1m2!1s100377111749062022464!2s0x0:0xfea3db2a133813dc?hl=en-US,Kira Svirsky,https://lh6.googleusercontent.com/-CputAjv4-iU/AAAAAAAAAAI/AAAAAAAAAYQ/AMZuucl4OFGUh3UUPPSyaKP15MX3mWf9Xg/c0x00000000-cc-rp/photo.jpg,2020-02-10T07:44:00Z,5.0,Esta fue una experiencia tan deliciosa.¡Delicioso!,es,18348750280595084252-1581309886.013,ChIJQ7PTnCQB0oUR3BM4Eyrbo_4
https://www.google.com/maps/reviews/data=!4m5!14m4!1m3!1m2!1s107069440866929123728!2s0x0:0xfea3db2a133813dc?hl=en-US,Lily M,https://lh3.googleusercontent.com/a-/AOh14GigkI1Grs99hAXWpTzY-IZLcxwHwAwoGWDxQvH5FQ=c0x00000000-cc-rp,2020-01-19T09:01:00Z,4.0,"Caro.Originalmente íbamos al restaurante vecino desde aquí, pero se cierran extrañamente muy temprano para la cena, así que decidimos probarlo.La comida era muy creativa.
Yo diría que la ensalada nopal era demasiado salada.",es,18348750280595084252-1579413684.181,ChIJQ7PTnCQB0oUR3BM4Eyrbo_4
https://www.google.com/maps/reviews/data=!4m5!14m4!1m3!1m2!1s111945955466754911005!2s0x0:0xfea3db2a133813dc?hl=en-US,Matt Silverlock,https://lh3.googleusercontent.com/a-/AOh14GgaDPnYc70HWtzyyJ0gTHSENYC5i2C4TjkSHxJxVw=c0x00000000-cc-rp,2019-12-27T07:08:00Z,2.0,"Bastante decepcionante.La comida es muy de una sola nota, lo suficientemente sazonada, lo suficiente como para cancelar el resto de nuestro pedido y salir temprano.Para un bar de vinos, el menú de vinos era muy ligero.

(Raramente dejo malas críticas, pero me sentí obligado a aquí)",es,18348750280595084252-1577419716.732,ChIJQ7PTnCQB0oUR3BM4Eyrbo_4
https://www.google.com/maps/reviews/data=!4m5!14m4!1m3!1m2!1s104825457280148252190!2s0x0:0xfea3db2a133813dc?hl=en-US,Zach Thomas,https://lh3.googleusercontent.com/a-/AOh14GgxIhIWfGfntSeUo1q039KZF1Z5RH_g3OuTjTLeMlw=c0x00000000-cc-rp,2019-11-15T23:49:00Z,5.0,"Aterrizó hace unas horas y vino aquí porque estaba a pocos pasos del hotel.Las calificaciones de Google no decepcionaron.
Comencé con el agua del día, que era una infusión de jengibre de guayaba de piña.La salsa de pan y pimienta de pan y pimienta de maní era muy sabrosa.
Mi ""inicio"" era la médula ósea asada y solo tenía una queja;Lo terminé demasiado rápido.Son dos huesos grandes con la médula tan suculenta.La médula se cubre con una deliciosa salsa de tomatillo.Fue servido con Tostada Azul y Pico, que estaban muy por encima del promedio.
Cuanto más cerraba era el pulpo.En primer lugar, era un gran trozo carnoso de pulpo.En segundo lugar, tenía muchas cosas en marcha.Realmente saboreé cada bocado.

Solo estoy en CDM durante tres días, y hay tantos lugares que ""necesito"" probar.Dicho esto, estaré un poco decepcionado si no vuelvo aquí antes de irme.",es,18348750280595084252-1573850988.728,ChIJQ7PTnCQB0oUR3BM4Eyrbo_4
https://www.google.com/maps/reviews/data=!4m5!14m4!1m3!1m2!1s104115391243318030678!2s0x0:0xfea3db2a133813dc?hl=en-US,Erin Davenport,https://lh3.googleusercontent.com/a-/AOh14Gi1xgGRG6AlJ32aew3Sql09BwBf0xzuhS2p3F1j8g=c0x00000000-cc-rp,2019-11-07T06:18:00Z,1.0,"¡Al principio pensé que la comida era buena!Sin embargo, en mi opinión, mucho de eso fue ""demasiado sazonado"".Luego, después de comer el risotto de los camarones y la panceta de cerdo, ambos tenemos enfermedades alimentarias.Desafortunadamente, no puedo recomendar este restaurante por esa razón.",es,18348750280595084252-1573096733.529,ChIJQ7PTnCQB0oUR3BM4Eyrbo_4
https://www.google.com/maps/reviews/data=!4m5!14m4!1m3!1m2!1s105411614693555865238!2s0x0:0xfea3db2a133813dc?hl=en-US,Gabriella B.,https://lh3.googleusercontent.com/a-/AOh14GiCTYZRiajBZC1XJ42fUK33MlmxtnyiC-8lnHGh2Q=c0x00000000-cc-rp,2019-11-01T05:30:00Z,5.0,Exquisito lugar para una noche inolvidable.La comida es más allá de la bien y los chicos de servicio son bastante geniales.,es,18348750280595084252-1572575418.429,ChIJQ7PTnCQB0oUR3BM4Eyrbo_4
https://www.google.com/maps/reviews/data=!4m5!14m4!1m3!1m2!1s115513282284382560223!2s0x0:0xfea3db2a133813dc?hl=en-US,Edgar Kock,https://lh3.googleusercontent.com/a-/AOh14GhPVXCzG4sJ1U-blXxJ5_8n-6_rG3H90p4UpDLBXHQ=c0x00000000-cc-rp,2019-10-27T20:08:00Z,5.0,"Buena comida, atmósfera acogedora.",es,18348750280595084252-1572196104.468,ChIJQ7PTnCQB0oUR3BM4Eyrbo_4
https://www.google.com/maps/reviews/data=!4m5!14m4!1m3!1m2!1s114144049103685513144!2s0x0:0xfea3db2a133813dc?hl=en-US,Arc Subscriptions,https://lh4.googleusercontent.com/-nlFB2MmS7i8/AAAAAAAAAAI/AAAAAAAAAAA/AMZuucm5kOTwJeB5KvgX279CpwNH3XVNeg/c0x00000000-cc-rp/photo.jpg,2019-10-26T19:47:00Z,5.0,"Excelente cena la otra noche.Increíble selección de mezcal salvaje.Una de las botellas fue robada del territorio del cartel, supuestamente.Plato de champiñones",es,18348750280595084252-1572108478.769,ChIJQ7PTnCQB0oUR3BM4Eyrbo_4
https://www.google.com/maps/reviews/data=!4m5!14m4!1m3!1m2!1s113532961009733260532!2s0x0:0xfea3db2a133813dc?hl=en-US,Gus Alvarez Moreno,https://lh3.googleusercontent.com/a-/AOh14GjNL-Dn-EpiLeaMoEUXXPh9uZ8ifiZh3V5TiGAI=c0x00000000-cc-rp,2019-10-26T18:48:00Z,5.0,"Whata Great Breakfast.Tuve los huevos Alba.Una mezcla tan deliciosa de sabores, los huevos laterales soleados eran tan tiernos y la mezcla de sabores equilibrados, con plátano que agrega un dulce contraste a la composición;Un poco picante para aquellos que no comen comida picante, pero nada demasiado difícil de tomar.

Además, la Pan de Muerto de temporada es hermosa y deliciosa.Una visita obligada para intentarlo.

Por último y lo mejor, ¡este lugar es amigable para mascotas!
El personal es amable y cálido.Ciertamente tienes que venir.",es,18348750280595084252-1572104928.491,ChIJQ7PTnCQB0oUR3BM4Eyrbo_4
https://www.google.com/maps/reviews/data=!4m5!14m4!1m3!1m2!1s116835111047919059311!2s0x0:0xfea3db2a133813dc?hl=en-US,Andrew Henderson,https://lh3.googleusercontent.com/a-/AOh14Gh1u-NMY0cdRqgiyLQfF3vdR_V9SCJiUOCkqorzNSg=c0x00000000-cc-rp,2019-10-06T19:37:00Z,4.0,Lindo café y desayuno con servicio rápido e de habla inglesa.,es,18348750280595084252-1570379821.594,ChIJQ7PTnCQB0oUR3BM4Eyrbo_4
https://www.google.com/maps/reviews/data=!4m5!14m4!1m3!1m2!1s114005403503454205918!2s0x0:0xfea3db2a133813dc?hl=en-US,Alex Delechambre,https://lh3.googleusercontent.com/a-/AOh14Ght1_TtOrK26Q4jTuIp1c2iju5Dm6fR-q1krEnT=c0x00000000-cc-rp,2019-08-18T18:47:00Z,5.0,"Excelente desayuno en el coronel Juárez.Sirven la comida tradicional mexicana pero preparados y presentados de manera moderna.El interior es aireado y cómodo, con mesas repartidas en 2 pisos.Fui por el brunch y recomendé encarecidamente los Divorciados de Huevos.El servicio es amigable y profesional.",es,18348750280595084252-1566143272.635,ChIJQ7PTnCQB0oUR3BM4Eyrbo_4
https://www.google.com/maps/reviews/data=!4m5!14m4!1m3!1m2!1s102758151592415481418!2s0x0:0xfea3db2a133813dc?hl=en-US,Alessandro Labelli,https://lh3.googleusercontent.com/a-/AOh14GhVdNu7iJfbYXgdIZkhbO9z4M53R8ToA5N-wYXuwQ=c0x00000000-cc-rp,2019-08-03T21:03:00Z,4.0,"Fui por el brunch.Alba es un buen café que también sirve algo de comida.Tiene dos historias: nos sentamos arriba, ya que parece que abajo es más como un bar de vinos (que estaba cerrado).El café estaba bien y los platos eran originales y sabrosos.Definitivamente es un lugar tranquilo.",es,18348750280595084252-1564855398.932,ChIJQ7PTnCQB0oUR3BM4Eyrbo_4
https://www.google.com/maps/reviews/data=!4m5!14m4!1m3!1m2!1s110864930750636997050!2s0x0:0xfea3db2a133813dc?hl=en-US,Diana Arias,https://lh3.googleusercontent.com/a-/AOh14GjTHhzS08V55OsVx5GWHUTeiUxGNMonpvok858I194=c0x00000000-cc-rp,2019-07-29T23:08:00Z,5.0,"El cómodo lugar para una excelente comida, los precios son justos para la calidad de la comida.No estaba demasiado lleno cuando fuimos, así que fue bastante agradable.",es,18348750280595084252-1564430898.691,ChIJQ7PTnCQB0oUR3BM4Eyrbo_4
https://www.google.com/maps/reviews/data=!4m5!14m4!1m3!1m2!1s118296478711999260448!2s0x0:0xfea3db2a133813dc?hl=en-US,Tobias Knoke,https://lh3.googleusercontent.com/a-/AOh14GhTph-pYWe0YahC5EkOJBDMzfTgbZU98V_2l4QMtA=c0x00000000-cc-rp,2019-07-27T20:59:00Z,5.0,"Gran desayuno.Muy recomendable.Prueba los Huevos Divorciados.Son tan buenos que todavía doy cinco estrellas, aunque el café podría ser mejor.",es,18348750280595084252-1564250352.144,ChIJQ7PTnCQB0oUR3BM4Eyrbo_4
https://www.google.com/maps/reviews/data=!4m5!14m4!1m3!1m2!1s113189575582506559690!2s0x0:0xfea3db2a133813dc?hl=en-US,Paul Mayencourt,https://lh6.googleusercontent.com/-REj9uIp2qs4/AAAAAAAAAAI/AAAAAAAAAAA/AMZuuckz9PAUaq0a3tNQmryhwxDs9ucYAQ/c0x00000000-cc-rp/photo.jpg,2019-06-22T01:04:00Z,5.0,Súper bueno y creativo!,es,18348750280595084252-1561154642.408,ChIJQ7PTnCQB0oUR3BM4Eyrbo_4
https://www.google.com/maps/reviews/data=!4m5!14m4!1m3!1m2!1s103662358294154975504!2s0x0:0xfea3db2a133813dc?hl=en-US,Sam Nehme,https://lh3.googleusercontent.com/a-/AOh14Ghjc42DeeM3sSGCYZob81sIbkiFdJMLKOcsEWUZXA=c0x00000000-cc-rp,2019-06-07T05:06:00Z,5.0,¡Berenice era una camarera increíble!Llegué temprano a cenar y ella me hizo sentir súper cómoda pasando el rato.La comida en sí también era increíble.¡Colorido y sabroso!Definitivamente vale la pena.Disculpe las capturas de pantalla de Insta Pic,es,18348750280595084252-1559873189.499,ChIJQ7PTnCQB0oUR3BM4Eyrbo_4
https://www.google.com/maps/reviews/data=!4m5!14m4!1m3!1m2!1s102645404941062319212!2s0x0:0xfea3db2a133813dc?hl=en-US,Gabriel Dallas,https://lh3.googleusercontent.com/-Hvekd_0Us8g/AAAAAAAAAAI/AAAAAAAAAAA/AMZuuclI_SMy846qRxGe8SNqIM0qJY2Ymg/c0x00000000-cc-rp/photo.jpg,2019-06-02T07:18:00Z,5.0,Absolutamente fenomenal,es,18348750280595084252-1559449083.822,ChIJQ7PTnCQB0oUR3BM4Eyrbo_4
https://www.google.com/maps/reviews/data=!4m5!14m4!1m3!1m2!1s113830104137639580804!2s0x0:0xfea3db2a133813dc?hl=en-US,Zulema Couso,https://lh3.googleusercontent.com/a-/AOh14GhsfF_cq7UG4KmULaA0Sj2_0RuYNuvFlqqetsZ3KN8=c0x00000000-cc-rp,2019-05-05T02:19:00Z,5.0,La deliciosa comida mexicana moderna en una ubicación moderna con personal muy amable,es,18348750280595084252-1557011954.046,ChIJQ7PTnCQB0oUR3BM4Eyrbo_4
https://www.google.com/maps/reviews/data=!4m5!14m4!1m3!1m2!1s105236614751092709547!2s0x0:0xfea3db2a133813dc?hl=en-US,Manal Khan,https://lh3.googleusercontent.com/a-/AOh14Gg9s7Hpa35weACDt4BSIUzKLqbUaX3kqyTWt0OI=c0x00000000-cc-rp,2019-03-24T20:04:00Z,5.0,"¡Fuimos a la mayoría de los restaurantes de la ciudad, y Alba los superó a todos!Una visita obligada: todos los platos se colocaron bellamente con tantas capas de sabores.¡El servicio también fue excepcional!",es,18348750280595084252-1553447098.966,ChIJQ7PTnCQB0oUR3BM4Eyrbo_4
https://www.google.com/maps/reviews/data=!4m5!14m4!1m3!1m2!1s102518946553341942301!2s0x0:0xfea3db2a133813dc?hl=en-US,Nadim Hachem,https://lh3.googleusercontent.com/a-/AOh14GgPd9lI-hSKUfAmgNGTW9oZSWGgZEO9wNRZbOr9aQ=c0x00000000-cc-rp,2019-03-24T06:07:00Z,5.0,Probablemente uno de los restaurantes más subestimados en CDM.Debes visitar.,es,18348750280595084252-1553396860.48,ChIJQ7PTnCQB0oUR3BM4Eyrbo_4
https://www.google.com/maps/reviews/data=!4m5!14m4!1m3!1m2!1s102440273556490186623!2s0x0:0xfea3db2a133813dc?hl=en-US,Diana Osorio,https://lh3.googleusercontent.com/a-/AOh14GiwCQTNUDpyMNbtPJj-SN20GTLWy4fA2jWz5LEfp7U=c0x00000000-cc-rp,2019-03-23T07:39:00Z,5.0,"Excelente restaurante pequeño acogedor.Chef increíble, platos muy originales y todos los productos son frescos, el pan increíble.La comida no es demasiado picante, puede solicitar más picante si lo desea.Hermosa presentación y excelente servicio un poco caro $$$",es,18348750280595084252-1553315986.679,ChIJQ7PTnCQB0oUR3BM4Eyrbo_4
https://www.google.com/maps/reviews/data=!4m5!14m4!1m3!1m2!1s103152294398458042062!2s0x0:0xfea3db2a133813dc?hl=en-US,Melanie Bruyere,https://lh5.googleusercontent.com/-2Le7HZ1xgyY/AAAAAAAAAAI/AAAAAAAAAAA/AMZuucnHNFr_YrR3uMsnkFZKpjFYvX_lWw/c0x00000000-cc-rp/photo.jpg,2019-03-06T20:51:00Z,5.0,"Muy buena, buena experiencia, lo recomiendo :)",es,18348750280595084252-1551894693.737,ChIJQ7PTnCQB0oUR3BM4Eyrbo_4
https://www.google.com/maps/reviews/data=!4m5!14m4!1m3!1m2!1s110844561731049123835!2s0x0:0xfea3db2a133813dc?hl=en-US,whoisjbrito,https://lh3.googleusercontent.com/a-/AOh14GjHfHoEFkhHKc-0GYfsfhS5v9HksWSTc822Ddducg=c0x00000000-cc-rp,2019-03-05T08:18:00Z,5.0,Comida increíble,es,18348750280595084252-1551763117.14,ChIJQ7PTnCQB0oUR3BM4Eyrbo_4
https://www.google.com/maps/reviews/data=!4m5!14m4!1m3!1m2!1s114457308091017310215!2s0x0:0xfea3db2a133813dc?hl=en-US,Kerri Moore,https://lh6.googleusercontent.com/-7zzsxieiLxw/AAAAAAAAAAI/AAAAAAAAAAA/AMZuuckVy-SrhiZ8NAyPaa9YVjW_RF0yqA/c0x00000000-cc-rp/photo.jpg,2019-02-23T02:08:00Z,5.0,"Vine aquí después de leer las grandes reseñas y no se decepcionó: un restaurante fantástico con personal conocedor y atento, y platos que han sido cuidadosamente elaborados con sabores delicados.Pensé que iba a luchar con las opciones vegetarianas, ya que solo tenían platos vegetarianos, pero mi novio y yo compartimos 3 platos y nos fuimos muy satisfechos.Definitivamente volveremos :)",es,18348750280595084252-1550876882.788,ChIJQ7PTnCQB0oUR3BM4Eyrbo_4
https://www.google.com/maps/reviews/data=!4m5!14m4!1m3!1m2!1s110827429874296068545!2s0x0:0xfea3db2a133813dc?hl=en-US,Vinka,https://lh3.googleusercontent.com/a-/AOh14GheiXi1TO2FUiE0ebx59Hp7KSq49OsiG3-VmDf-Cg=c0x00000000-cc-rp,2019-01-03T20:56:00Z,5.0,Comida de alta calidad y ambiente relajado.Fantástico desayuno (¡tuve el mejor Pan de Muertos aquí!) Y un servicio al cliente estelar!Comimos aquí cuatro veces durante nuestra última visita.¡Volverá pronto!,es,18348750280595084252-1546538187.211,ChIJQ7PTnCQB0oUR3BM4Eyrbo_4
https://www.google.com/maps/reviews/data=!4m5!14m4!1m3!1m2!1s108765830291732306261!2s0x0:0x418427adde3f7199?hl=en-US,Alvaro Reyes,https://lh3.googleusercontent.com/a-/AOh14GgWy6VaekjGlVnf4ymDcnf8D3D3_CT8YSYvi3PtJw=c0x00000000-cc-rp,2020-08-07T01:07:00Z,5.0,fiambres,es,4720941937102647705-1596751645.686,ChIJR6RG1pv_0YURmXE_3q0nhEE
https://www.google.com/maps/reviews/data=!4m5!14m4!1m3!1m2!1s110346524548940348492!2s0x0:0x418427adde3f7199?hl=en-US,Jorge Gausho,https://lh3.googleusercontent.com/a-/AOh14GhRPLzi31SDcRsQFVol04V43VwMUk4U3vMytkbGPVY=c0x00000000-cc-rp,2020-07-20T06:27:00Z,5.0,Uuuufff bb,es,4720941937102647705-1595215632.429,ChIJR6RG1pv_0YURmXE_3q0nhEE
https://www.google.com/maps/reviews/data=!4m5!14m4!1m3!1m2!1s114917022188760570184!2s0x0:0x418427adde3f7199?hl=en-US,Cristian Nava Diaz,https://lh3.googleusercontent.com/a-/AOh14Gj2yUB_l-_3ztk88pGeEN74X_3Erl7a5193Xc5W=c0x00000000-cc-rp,2020-03-27T08:22:00Z,5.0,"Fonda 99.99 es un restaurante que se especializa en la cocina yucatecana.Todo lo que hemos probado es delicioso.La última vez que visitamos el lugar donde teníamos la sopa de frijoles y la carne de pollo y ambos fueron excelentes.El camarero fue muy rápido y servicial.Sin lugar a dudas, visitaré el restaurante la próxima vez que esté cerca.",es,4720941937102647705-1585286529.608,ChIJR6RG1pv_0YURmXE_3q0nhEE
https://www.google.com/maps/reviews/data=!4m5!14m4!1m3!1m2!1s109969338108937331254!2s0x0:0x418427adde3f7199?hl=en-US,Jennifer Soh,https://lh3.googleusercontent.com/a-/AOh14GhhNnK4kxwwFszeBO5S1MeU1Anv6ZU_pJlsVrFrIj0=c0x00000000-cc-rp,2020-03-16T16:24:00Z,5.0,¡Yum!,es,4720941937102647705-1584365065.189,ChIJR6RG1pv_0YURmXE_3q0nhEE
https://www.google.com/maps/reviews/data=!4m5!14m4!1m3!1m2!1s117888968917494513168!2s0x0:0x418427adde3f7199?hl=en-US,Omega Garcia,https://lh3.googleusercontent.com/a-/AOh14GjWv5SCEQM5RsitlI5VGVFdf7YPlXoFfNsVWS8b5-I=c0x00000000-cc-rp,2020-03-15T21:21:00Z,5.0,¡Buena comida!¡¡¡Solamente efectivo!!!,es,4720941937102647705-1584296518.899,ChIJR6RG1pv_0YURmXE_3q0nhEE
https://www.google.com/maps/reviews/data=!4m5!14m4!1m3!1m2!1s101903967242202211369!2s0x0:0x418427adde3f7199?hl=en-US,manoj harpalani,https://lh3.googleusercontent.com/a-/AOh14GjA352WGaJfOickHMTtBvi47bJUuEuINX278AQZvw=c0x00000000-cc-rp,2020-03-14T09:30:00Z,5.0,Uno de los mejores lugares para la auténtica comida de Yucateca,es,4720941937102647705-1584167449.285,ChIJR6RG1pv_0YURmXE_3q0nhEE
https://www.google.com/maps/reviews/data=!4m5!14m4!1m3!1m2!1s105903348217106133845!2s0x0:0x418427adde3f7199?hl=en-US,Eder Alvardo,https://lh3.googleusercontent.com/a-/AOh14GhmrxXJ8I05pz2_iDO5IKxAgRL9faZHiFcFdDNv=c0x00000000-cc-rp,2020-03-08T03:49:00Z,3.0,El lugar solo acepta efectivo.,es,4720941937102647705-1583628588.875,ChIJR6RG1pv_0YURmXE_3q0nhEE
https://www.google.com/maps/reviews/data=!4m5!14m4!1m3!1m2!1s104619347120373677200!2s0x0:0x27cb0d4b970c6763?hl=en-US,Joan Enric Fernández,https://lh3.googleusercontent.com/a-/AOh14GhVWttqMha58NK8OEBWwmfU8PEmNA3j76WyUYeRrA=c0x00000000-cc-rp,2020-02-05T00:47:00Z,5.0,Impresionante,es,2867400206059333475-1580852829.498,ChIJR9WWFMP_0YURY2cMl0sNyyc
https://www.google.com/maps/reviews/data=!4m5!14m4!1m3!1m2!1s118302973359039841695!2s0x0:0x27cb0d4b970c6763?hl=en-US,mohammadreza karami,https://lh3.googleusercontent.com/a-/AOh14GjNrsbBqYCx4VEyJgh06dgjk4R6v5GWh5-IdESOGQ=c0x00000000-cc-rp,2020-01-27T08:05:00Z,4.0,Buena comida buena precio,es,2867400206059333475-1580101511.582,ChIJR9WWFMP_0YURY2cMl0sNyyc
https://www.google.com/maps/reviews/data=!4m5!14m4!1m3!1m2!1s115032155878048836783!2s0x0:0x27cb0d4b970c6763?hl=en-US,Francisco Garza,https://lh3.googleusercontent.com/a-/AOh14GiBWRzDWhkYyX6wvMYf-7B3OAdL58EkdFEYFxT9kg=c0x00000000-cc-rp,2020-01-21T02:02:00Z,4.0,Bbb,es,2867400206059333475-1579561342.208,ChIJR9WWFMP_0YURY2cMl0sNyyc
https://www.google.com/maps/reviews/data=!4m5!14m4!1m3!1m2!1s102382290166242523995!2s0x0:0x27cb0d4b970c6763?hl=en-US,Daniela Patron,https://lh5.googleusercontent.com/-fxl3yJ4tsOM/AAAAAAAAAAI/AAAAAAAAAAA/AMZuuckegSEB128Vc85-o7EUn3tMn-QVWQ/c0x00000000-cc-rp/photo.jpg,2019-12-15T01:51:00Z,5.0,fiambres,es,2867400206059333475-1576363895.652,ChIJR9WWFMP_0YURY2cMl0sNyyc
https://www.google.com/maps/reviews/data=!4m5!14m4!1m3!1m2!1s102816575774678255624!2s0x0:0x27cb0d4b970c6763?hl=en-US,NAYELY URIOSTE,https://lh3.googleusercontent.com/a-/AOh14GjSuGs_Y8Czbz81IzgTFd3K1FKNmh7XK4-YalKG3A=c0x00000000-cc-rp,2019-11-13T22:15:00Z,5.0,Delicioso,es,2867400206059333475-1573672501.904,ChIJR9WWFMP_0YURY2cMl0sNyyc
https://www.google.com/maps/reviews/data=!4m5!14m4!1m3!1m2!1s117158388456216644710!2s0x0:0x27cb0d4b970c6763?hl=en-US,Quincy P,https://lh5.googleusercontent.com/-4dG7fM1TDOY/AAAAAAAAAAI/AAAAAAAAAAA/AMZuucnSP4W-1uY0NFtaZsG3AlCHvf-tDA/c0x00000000-cc-rp/photo.jpg,2019-11-13T06:12:00Z,5.0,"Mi novio y yo obtuvimos 5 tostadas diferentes y todas estaban súper frescas y deliciosas (incluso la vegetariana nos dejó boquiabiertos).El menú del día incluye ensalada, sopa, agua fresca, una tostada de su elección y postre a un precio muy razonable.Muy recomendable.",es,2867400206059333475-1573614720.966,ChIJR9WWFMP_0YURY2cMl0sNyyc
https://www.google.com/maps/reviews/data=!4m5!14m4!1m3!1m2!1s111472736773403233057!2s0x0:0x27cb0d4b970c6763?hl=en-US,Charlotte PARIS,https://lh3.googleusercontent.com/a-/AOh14Gg1HIHE_H9gtarXIlpo5M66pQVnv_asZ3Hx22t0=c0x00000000-cc-rp,2019-10-18T03:30:00Z,5.0,"Un restaurante pequeño, con alrededor de 8 mesas de 4, personal súper agradable y servicial, servicio rápido y ... bueno, la comida es absolutamente deliciosa.Fui por la pequeña SOPA y una Tostadas de Tuna, todo estaba muy fresco y muy sabroso, con sabores que pagarías más por el regreso a casa.No solo la opción segura, sino emocionante para el almuerzo o la cena.",es,2867400206059333475-1571358605.65,ChIJR9WWFMP_0YURY2cMl0sNyyc
